{
  "decoded": "quest/scenario/etc/etc1g1",
  "ciphered": "tp5rq/r75w9s1v/5q7/5q7i3i.lua",
  "classes": [
    "Etc1g1"
  ],
  "lineCount": 213,
  "apiCount": 4,
  "callsiteCount": 6,
  "apis": {
    "_defineClass": [
      5
    ],
    "_loadTextDataPermanently": [
      14
    ],
    "_runBgScheduler": [
      208
    ],
    "_runCharaScheduler": [
      49,
      140,
      176
    ]
  }
}
