{
  "decoded": "chara/npc/monster/fighter/fighterenemygladiatorfactionemp",
  "ciphered": "729s9/wu7/xvwrq5s/4132q5s/4132q5s5w5xl3y9619qvs497q1vw5xu.lua",
  "classes": [
    "FighterEnemyGladiatorFactionEmp"
  ],
  "lineCount": 8,
  "apiCount": 1,
  "callsiteCount": 1,
  "apis": {
    "_defineClass": [
      5
    ]
  }
}
