{
  "decoded": "chara/npc/monster/birdman/birdmanmarauderlesserstd",
  "ciphered": "729s9/wu7/xvwrq5s/81s6x9w/81s6x9wx9s9p65sy5rr5srq6.lua",
  "classes": [
    "BirdmanMarauderLesserStd"
  ],
  "lineCount": 8,
  "apiCount": 1,
  "callsiteCount": 1,
  "apis": {
    "_defineClass": [
      5
    ]
  }
}
