{
  "decoded": "chara/npc/monster/lizardman/lizardmanpugiliststandard",
  "ciphered": "729s9/wu7/xvwrq5s/y1k9s6x9w/y1k9s6x9wup31y1rqrq9w69s6.lua",
  "classes": [
    "LizardmanPugilistStandard"
  ],
  "lineCount": 8,
  "apiCount": 1,
  "callsiteCount": 1,
  "apis": {
    "_defineClass": [
      5
    ]
  }
}
