{
  "decoded": "chara/npc/monster/lizardman/lizardmanthmpublicfortguard01",
  "ciphered": "729s9/wu7/xvwrq5s/y1k9s6x9w/y1k9s6x9wq2xup8y174vsq3p9s6ji.lua",
  "classes": [
    "LizardmanThmPublicFortGuard01"
  ],
  "lineCount": 8,
  "apiCount": 1,
  "callsiteCount": 1,
  "apis": {
    "_defineClass": [
      5
    ]
  }
}
