{
  "decoded": "chara/npc/monster/fighter/fightergladiatorgreinfarr",
  "ciphered": "729s9/wu7/xvwrq5s/4132q5s/4132q5s3y9619qvs3s51w49ss.lua",
  "classes": [
    "FighterGladiatorGreinfarr"
  ],
  "lineCount": 8,
  "apiCount": 1,
  "callsiteCount": 1,
  "apis": {
    "_defineClass": [
      5
    ]
  }
}
