{
  "decoded": "chara/npc/monster/kesaranpasaran/kesaranpasaranbaseclass",
  "ciphered": "729s9/wu7/xvwrq5s/z5r9s9wu9r9s9w/z5r9s9wu9r9s9w89r57y9rr.lua",
  "classes": [
    "KesaranpasaranBaseClass"
  ],
  "lineCount": 8,
  "apiCount": 1,
  "callsiteCount": 1,
  "apis": {
    "_defineBaseClass": [
      5
    ]
  }
}
