{
  "decoded": "director/quest/simplequestbattle/questdirectordrg0j601",
  "ciphered": "61s57qvs/tp5rq/r1xuy5tp5rq89qqy5/tp5rq61s57qvs6s3j0dji.lua",
  "classes": [
    "QuestDirectorDrg0j601"
  ],
  "lineCount": 8,
  "apiCount": 1,
  "callsiteCount": 1,
  "apis": {
    "_defineClass": [
      5
    ]
  }
}
