{
  "decoded": "chara/npc/populace/populacefactionglworker",
  "ciphered": "729s9/wu7/uvupy975/uvupy975497q1vw3ynvsz5s.lua",
  "classes": [
    "PopulaceFactionGLWorker"
  ],
  "lineCount": 3875,
  "apiCount": 12,
  "callsiteCount": 212,
  "apis": {
    "_defineClass": [
      5
    ],
    "_fadeIn": [
      3101
    ],
    "_fadeOut": [
      3090
    ],
    "_getData": [
      115,
      3637,
      3680,
      3796,
      3812
    ],
    "_getMyPlayer": [
      140,
      660,
      1189,
      2028,
      2228,
      2399,
      3163,
      3280
    ],
    "_loadKeyTemporarily": [
      109,
      3629,
      3672,
      3788,
      3804
    ],
    "_loadTextDataPermanently": [
      127
    ],
    "_math": [
      3851
    ],
    "_runCharaScheduler": [
      149,
      172,
      196,
      227,
      281,
      297,
      314,
      324,
      335,
      345,
      356,
      366,
      377,
      387,
      398,
      408,
      419,
      435,
      452,
      468,
      485,
      501,
      518,
      540,
      557,
      567,
      579,
      590,
      601,
      612,
      623,
      634,
      670,
      675,
      708,
      724,
      747,
      763,
      866,
      888,
      905,
      921,
      938,
      954,
      971,
      987,
      1004,
      1020,
      1037,
      1053,
      1070,
      1088,
      1163,
      1210,
      1234,
      1244,
      1254,
      1294,
      1310,
      1327,
      1343,
      1360,
      1376,
      1393,
      1409,
      1426,
      1442,
      1459,
      1475,
      1492,
      1508,
      1519,
      1535,
      1552,
      1568,
      1585,
      1601,
      1618,
      1634,
      1651,
      1667,
      1683,
      1699,
      1722,
      1738,
      1754,
      1771,
      1787,
      1805,
      1817,
      1828,
      1840,
      1851,
      1862,
      1873,
      1884,
      1895,
      1907,
      1918,
      1931,
      1942,
      1955,
      1966,
      1978,
      1989,
      2000,
      2037,
      2048,
      2059,
      2076,
      2093,
      2104,
      2115,
      2138,
      2161,
      2184,
      2207,
      2237,
      2248,
      2259,
      2270,
      2287,
      2304,
      2321,
      2344,
      2361,
      2378,
      2408,
      2425,
      2442,
      2467,
      2490,
      2514,
      2531,
      2548,
      2566,
      2583,
      2600,
      2618,
      2635,
      2652,
      2670,
      2687,
      2704,
      2722,
      2733,
      2750,
      2768,
      2779,
      2796,
      2814,
      2825,
      2848,
      2872,
      2883,
      2906,
      2930,
      2941,
      2964,
      2988,
      2999,
      3016,
      3034,
      3045,
      3062,
      3080,
      3108,
      3130,
      3298,
      3315,
      3338,
      3349,
      3366,
      3383,
      3395,
      3409,
      3420,
      3437,
      3449,
      3468,
      3479,
      3490,
      3501
    ],
    "_setGroundOn": [
      104
    ],
    "_wait": [
      1198,
      2014,
      3097
    ],
    "_waitForFading": [
      3094,
      3105
    ]
  }
}
