{
  "decoded": "chara/npc/monster/fighter/fighterallygladiatornormal",
  "ciphered": "729s9/wu7/xvwrq5s/4132q5s/4132q5s9yyl3y9619qvswvsx9y.lua",
  "classes": [
    "FighterAllyGladiatorNormal"
  ],
  "lineCount": 17,
  "apiCount": 1,
  "callsiteCount": 1,
  "apis": {
    "_defineClass": [
      5
    ]
  }
}
